log_id,employee_id,log_date,status,remarks
813,860,2025-06-01,Pending,Much rate standard today government actually myself.
814,134,2025-04-02,Failure,Parent hit east among.
815,912,2024-08-28,Success,Resource create hit yes without foot.
816,148,2024-11-12,Failure,Me certain person director summer thing activity.
817,336,2025-07-27,Success,Method resource how listen.
818,71,2025-04-11,Failure,Method attack interesting writer everything.
819,233,2024-10-26,Pending,True western energy into stay.
820,334,2025-06-12,Pending,Standard these read little people.
821,811,2024-11-17,Failure,Relate need administration rather sense song prove.
822,666,2025-01-08,Failure,Poor but Mr whether mention.
823,90,2025-01-05,Failure,Them save sound nothing international.
824,334,2024-12-27,Success,Month simply those share out fill world loss.
825,199,2025-02-28,Failure,Study bit style race.
826,161,2025-07-03,Failure,Heavy already become rock our.
827,538,2024-08-18,Success,Report company car data news difficult.
828,121,2025-04-12,Pending,Clear dog nothing billion wish world process.
829,301,2025-04-07,Failure,Air turn church thing decide common term.
830,724,2025-06-05,Failure,Republican news deep.
831,575,2025-01-19,Pending,Building staff address discover.
832,963,2025-08-08,Pending,Administration reality history.
833,436,2024-09-17,Success,Here and ahead subject others test.
834,68,2025-04-25,Failure,Resource business natural stand country himself behavior.
835,765,2024-11-15,Failure,True dog need up.
836,922,2024-10-10,Success,Political be member another lot.
837,459,2025-02-28,Pending,Situation short nearly catch fire impact.
838,514,2024-10-30,Success,First put best about safe yes lead seem.
839,398,2024-09-04,Pending,About stage everything forget.
840,620,2024-11-08,Success,Here street former total animal item to hope.
841,286,2024-12-13,Pending,Begin actually positive trouble federal.
842,561,2025-02-03,Success,Remember region through wall.
843,140,2024-09-23,Pending,Ability language food human stand.
844,730,2024-12-27,Pending,Especially peace among past happen no crime information.
845,556,2025-01-14,Pending,Family cell move nothing perform.
846,929,2025-04-29,Pending,Home learn address doctor.
847,781,2024-10-26,Pending,Newspaper mind play brother more radio.
848,590,2025-01-30,Failure,Sit authority air sort investment guy such.
849,728,2024-10-15,Pending,Lawyer help really door against beautiful it.
850,894,2024-12-06,Failure,Lawyer white miss next their herself.
851,610,2024-12-16,Pending,Within network accept want today.
852,748,2025-01-15,Failure,Various wait six guess member will.
853,282,2025-05-07,Failure,Leave lead relationship provide.
854,661,2025-07-02,Success,Major his continue avoid.
855,924,2025-02-20,Pending,Pull strong necessary exactly part or vote.
856,816,2024-08-31,Success,Entire class owner local mention avoid.
857,996,2024-11-27,Success,Specific think tree.
858,936,2025-01-28,Pending,Return hand trouble black network.
859,578,2024-10-26,Success,Health street animal itself media.
860,746,2024-10-20,Pending,Suddenly center suddenly.
861,457,2025-01-19,Success,Market a off visit anyone place.
862,87,2025-05-09,Pending,Understand together improve week least.
863,79,2025-03-06,Pending,Still everything ten yeah me.
864,205,2025-07-07,Pending,Particularly thought those evidence around magazine present.
865,791,2024-09-28,Failure,Consumer read response drive carry information hope.
866,337,2025-02-14,Success,Under some health loss arrive goal none.
867,254,2025-06-27,Failure,Before off window particular.
868,304,2024-09-19,Success,Though body staff beat control ball they.
869,380,2024-12-30,Success,Dinner stage soldier apply notice current.
870,130,2025-05-11,Success,Left special order.
871,596,2025-05-29,Failure,Above low town.
872,276,2024-09-26,Success,Theory off fine represent.
873,699,2025-04-29,Failure,Dinner position something miss including.
874,558,2025-07-18,Pending,Of tend include capital either what she.
875,899,2025-01-22,Success,Student because person return understand within.
876,183,2025-06-26,Success,Source specific bar top rise.
877,268,2025-06-27,Pending,Along forward child simple.
878,808,2024-08-22,Pending,Idea range attention throughout degree think so growth.
879,322,2024-10-19,Success,Model thing drop the character.
880,512,2024-12-19,Pending,Art television without itself seat language open.
881,612,2024-10-06,Failure,Wrong you through us me.
882,78,2025-03-29,Failure,Field computer son him wonder traditional why.
883,784,2025-03-02,Success,Image case answer free knowledge.
884,339,2025-01-14,Failure,Until relate hour large friend bag.
885,674,2025-05-11,Failure,City north role act alone view.
886,556,2025-02-10,Success,Blue management record room program outside.
887,509,2024-08-22,Pending,Between bar beyond single walk.
888,238,2025-02-22,Success,Over rather central south.
889,134,2025-04-28,Failure,Radio approach reflect collection agency response.
890,973,2025-05-05,Success,Try fire turn environmental wait radio.
891,192,2025-01-21,Success,Throw project consider.
892,356,2025-01-29,Failure,Size tonight ground while action teacher.
893,278,2025-06-13,Failure,Bad book Democrat.
894,18,2024-09-08,Success,Trade get something rather.
895,524,2024-12-13,Failure,Employee plant pay allow executive what manage share.
896,180,2025-01-30,Failure,Suddenly less nearly us remain.
897,123,2024-11-26,Failure,Purpose popular tree project stop answer work explain.
898,246,2025-06-02,Failure,Democratic fight return data today budget everyone call.
899,734,2025-04-21,Failure,There into media.
900,373,2024-10-02,Failure,Ask myself phone travel western.
901,51,2025-04-09,Pending,They pattern company nation get seek.
902,1000,2025-06-27,Success,Rather future animal hold almost imagine.
903,71,2025-06-25,Failure,Notice officer popular huge investment trial station.
904,480,2025-08-05,Success,Available hit keep enjoy.
905,560,2025-02-08,Pending,You may reason by threat.
906,19,2025-02-28,Failure,Production now eye ok white.
907,774,2025-01-09,Success,Technology after hotel learn serve suffer.
908,84,2025-06-17,Failure,Foreign design plan stock authority defense.
909,155,2025-02-17,Failure,Finish candidate hospital experience least effort.
910,565,2025-05-21,Failure,Article cost water reflect change smile film task.
911,619,2024-12-26,Failure,Address skin number poor.
912,357,2025-07-11,Failure,Stuff another each PM where new.
913,816,2025-03-13,Failure,Member drug charge total because hotel.
914,647,2025-01-06,Failure,Some pattern according to free.
915,443,2024-09-30,Pending,Free theory none so myself follow not.
916,69,2025-06-19,Pending,Because order order interest.
917,523,2024-10-26,Failure,House discuss successful industry.
918,143,2025-01-29,Failure,Something those center have.
919,192,2025-03-12,Pending,Cost eight work three reason call traditional.
920,387,2025-06-09,Pending,Before general class require.
921,378,2025-01-13,Pending,Accept country red collection positive part produce.
922,581,2025-07-21,Failure,Good travel size mission.
923,535,2025-05-07,Success,Reveal rather not its significant me deep.
924,693,2024-09-18,Success,Forward nearly room thing notice less.
925,293,2024-10-15,Success,Cold real high might remember seek significant.
926,9,2024-08-20,Success,Long she record teach attack.
927,271,2024-12-26,Failure,Participant choice training look common meeting.
928,387,2025-08-15,Success,Which financial apply benefit method collection.
929,93,2025-05-19,Pending,Class approach necessary past Mr personal stuff.
930,966,2025-04-04,Pending,Career watch arrive become everything.
931,529,2024-11-26,Success,Pressure room under team security.
932,154,2024-11-02,Pending,Instead well growth own.
933,405,2025-03-05,Failure,Red pull save same camera.
934,840,2025-06-29,Success,Without everybody research chance system.
935,149,2025-04-13,Success,Response marriage sure camera.
936,889,2025-05-27,Failure,During responsibility among since.
937,267,2025-07-22,Pending,Me individual though imagine.
938,422,2025-02-10,Failure,Culture radio station general soldier discuss.
939,840,2025-02-02,Failure,Lead green total benefit Mr car.
940,618,2024-09-05,Pending,Raise prepare wrong bed.
941,472,2025-02-14,Failure,Like her part team.
942,893,2024-12-05,Pending,Old what design want.
943,547,2024-09-02,Pending,Enough success score.
944,631,2024-10-04,Failure,At hit class nothing soon.
945,526,2025-07-21,Pending,Voice information add argue image.
946,503,2025-02-24,Failure,Why individual wide hotel west theory.
947,14,2025-02-12,Pending,Himself red upon.
948,778,2025-01-07,Success,Now sound gun art.
949,652,2024-09-06,Pending,Expert several effort prevent kid issue woman range.
950,806,2025-07-29,Pending,Show response nothing gas few page cold couple.
951,364,2025-04-07,Failure,History its street because.
952,119,2025-05-11,Pending,Eight skill program try.
953,238,2025-01-08,Success,Wait never fly pull big method.
954,546,2024-11-23,Success,Player western move manage worry wear pay.
955,169,2025-01-30,Pending,Us challenge drive find star be over radio.
956,522,2024-12-27,Pending,Determine nice source thought result.
957,634,2025-05-07,Success,Water wind cost hand arm.
958,913,2024-12-11,Failure,Door early we we alone ready back.
959,657,2025-06-11,Success,Summer more if hear responsibility have.
960,963,2025-07-02,Success,Sing hospital ready push material somebody husband.
961,958,2024-08-27,Pending,Return wall trouble friend current.
962,735,2025-03-16,Pending,Job nor yard establish hit.
963,883,2024-11-29,Success,Since him southern issue town call computer experience.
964,769,2024-10-26,Failure,Movement traditional of.
965,780,2024-12-09,Success,True fill beautiful game set other follow vote.
966,871,2025-01-03,Success,High few land both two add thank.
967,516,2025-01-26,Failure,Carry happy response would enter.
968,938,2024-08-24,Success,Business sport apply property enter name.
969,397,2025-02-07,Success,Easy today wait staff feeling.
970,866,2024-12-22,Pending,Though degree special laugh include price.
971,106,2024-12-11,Failure,Difficult which quite adult move rather business.
972,85,2025-04-21,Pending,State turn center build happy near begin.
973,214,2024-08-31,Pending,Exactly choose guy wide evidence to item.
974,121,2025-04-06,Failure,Something employee such practice quickly any market.
975,132,2024-09-30,Failure,Thank value quality reality.
976,850,2025-01-03,Success,Someone themselves star development know laugh.
977,197,2025-05-29,Pending,Involve radio image crime about everything artist.
978,19,2024-09-01,Failure,Understand picture ground.
979,642,2025-03-12,Pending,Sport usually as until.
980,12,2025-05-31,Pending,For mind worker already TV low.
981,81,2025-01-18,Failure,Role assume control leg.
982,330,2024-11-22,Success,Build ago feeling whose realize.
983,866,2024-10-25,Pending,Shoulder design huge south.
984,774,2024-09-19,Failure,Manager clearly along business.
985,392,2025-03-13,Success,Performance go child simply compare result.
986,637,2024-09-23,Pending,Population offer piece machine early campaign health past.
987,307,2024-10-05,Failure,Travel chance character really spring.
988,267,2025-05-27,Pending,Record couple mission part ability.
989,447,2024-10-13,Failure,Table reality stock site develop government.
990,441,2025-04-20,Failure,Dinner interview medical will.
991,895,2025-02-25,Pending,However traditional necessary learn memory home marriage.
992,652,2025-02-01,Pending,Share southern stop customer.
993,841,2025-07-30,Failure,Better man choose.
994,2,2024-12-02,Success,Government suddenly statement network.
995,520,2024-12-30,Pending,Question place consumer bed teacher program success.
996,762,2025-02-11,Failure,Type seven move election I customer.
997,651,2025-05-12,Failure,Send capital decide wide describe real.
998,636,2025-04-14,Success,Center claim Republican admit.
999,309,2024-11-20,Success,Senior factor young get.
1000,740,2025-08-09,Success,Child staff yard place contain safe government.
1001,522,2025-07-04,Pending,Help start peace year.
1002,469,2025-08-03,Failure,He any hope strategy player.
1003,212,2025-07-08,Failure,Ten each talk boy area however society.
1004,112,2025-08-15,Failure,Bit door magazine firm task.
1005,8,2025-05-29,Success,Sign president food add process.
1006,804,2025-07-02,Failure,Simple company produce meet expert.
1007,477,2025-03-09,Pending,Director stock list half as room.
1008,874,2025-03-27,Success,And five notice son view process happy.
1009,460,2025-02-12,Success,Within environment back short pull form.
1010,253,2024-09-02,Success,Admit value before result or.
1011,526,2024-09-16,Success,Opportunity late market source art.
1012,752,2024-12-22,Pending,Specific adult collection.
1013,438,2025-01-09,Failure,Project author term many.
1014,754,2024-09-01,Pending,Rock bed film wait.
1015,981,2024-10-13,Failure,During respond town per leg note law.
1016,854,2025-04-11,Pending,Not model democratic.
1017,661,2025-05-26,Success,International throw discuss something.
1018,236,2025-04-22,Success,Car present push agreement.
1019,306,2025-06-29,Pending,Receive white movement little name good.
1020,478,2025-07-26,Pending,Wait rate too recognize final.
1021,679,2024-09-26,Failure,Owner picture him final.
1022,20,2025-01-13,Pending,West public size.
1023,216,2025-03-05,Pending,Consider by animal building attorney success.
1024,855,2025-05-26,Failure,Main her year none lay TV.
1025,135,2024-09-17,Failure,According anyone cell why less fill name.
1026,905,2024-12-27,Failure,Market fear language late finally wait.
1027,129,2025-08-13,Pending,Staff history girl real almost teach.
1028,410,2025-04-22,Failure,Age each fire.
1029,422,2025-06-04,Success,Like also school window north.
1030,294,2024-12-13,Success,Cost less bad third not group notice herself.
1031,246,2025-01-29,Success,Day reason order rest conference glass.
1032,701,2025-01-20,Pending,More leg purpose interview.
1033,556,2024-08-26,Success,Would table pass trouble per.
1034,86,2024-10-28,Pending,Subject shake particularly give example price easy.
1035,556,2025-06-04,Pending,Send themselves walk factor determine remember.
1036,842,2024-11-25,Success,Social figure building notice.
1037,375,2025-05-25,Failure,Operation send drug relationship tax every late difficult.
1038,446,2025-04-28,Pending,Theory enough moment put price.
1039,378,2025-06-02,Success,Commercial different order matter campaign reveal rich.
1040,390,2025-07-26,Pending,Write protect mouth side mission.
1041,657,2024-09-17,Failure,Between citizen whose young set.
1042,51,2025-07-09,Failure,Can reality boy long analysis force tonight.
1043,242,2025-08-07,Success,Girl expert report include from song car.
1044,294,2025-02-02,Pending,Also act few note.
1045,920,2024-10-02,Pending,High ask rich development area.
1046,563,2025-06-22,Pending,Center say green.
1047,266,2024-10-31,Pending,Single daughter tell four.
1048,120,2025-03-27,Success,Ten more organization couple old physical.
1049,712,2024-11-27,Failure,White new involve south two participant want.
1050,917,2024-12-13,Success,Relationship need country receive however.
1051,248,2025-04-14,Pending,Be development my he those.
1052,70,2025-03-05,Pending,Three couple imagine usually scientist.
1053,853,2025-03-15,Failure,Teach crime leader.
1054,57,2025-07-15,Pending,Enter debate blue feeling.
1055,382,2025-06-22,Success,Research indeed scientist push price sit music.
1056,39,2024-11-20,Success,Allow social write.
1057,984,2025-05-14,Failure,Represent today notice exactly send where.
1058,801,2025-06-24,Success,Though president position win.
1059,443,2024-09-05,Success,Threat ask enjoy year few success.
1060,18,2025-01-10,Success,Choice Mr social hand.
1061,952,2025-03-28,Success,Clear spring participant.
1062,732,2025-02-17,Pending,Instead full large front the.
1063,825,2024-11-09,Success,Current card yes perhaps.
1064,756,2025-06-09,Failure,Act administration form of blue.
1065,352,2025-08-16,Failure,There discover detail effect life.
1066,972,2025-02-03,Success,Safe but too situation.
1067,816,2024-12-02,Failure,Usually action task center long particular.
1068,298,2025-06-04,Success,Eat security community politics decision back.
1069,283,2025-05-12,Failure,Travel same news election.
1070,586,2025-06-16,Failure,Color ahead establish truth society another music.
1071,110,2024-10-29,Success,Attention win ok scientist yourself side before.
1072,180,2024-12-03,Success,Whatever product car appear.
1073,938,2025-02-28,Pending,Around sport reveal trouble else third.
1074,544,2025-05-05,Success,Role when story live player manager station.
1075,746,2024-09-04,Success,Black skill over television understand anyone.
1076,794,2025-04-09,Pending,Policy dinner their key small light.
1077,25,2025-01-19,Success,Fund the ask choose.
1078,843,2025-08-06,Success,Always what site gas hour move Republican trip.
1079,791,2024-10-27,Pending,Water magazine physical later.
1080,738,2025-05-08,Success,Some between be without.
1081,57,2024-12-06,Success,Most whole among recent.
1082,180,2024-12-01,Pending,Indeed truth pass prove through together lawyer.
1083,232,2024-08-19,Pending,Television machine really.
1084,894,2025-01-23,Failure,Usually our good onto people edge great our.
1085,343,2024-11-06,Success,Management common center man.
1086,477,2024-08-25,Failure,Security economic newspaper consider again tax.
1087,799,2025-06-17,Failure,Certain heart heavy fly.
1088,576,2025-01-25,Pending,Opportunity position sure court crime.
1089,455,2025-04-30,Success,Realize staff dark.
1090,232,2024-10-07,Success,Family kind toward adult maybe.
1091,289,2024-12-02,Pending,Material out two activity let source action.
1092,213,2024-11-29,Failure,Pass help medical glass partner themselves.
1093,258,2025-02-13,Pending,Small large either reduce consider.
1094,530,2025-04-07,Success,Play decide way our first do.
1095,687,2025-06-20,Pending,Laugh marriage five color.
1096,929,2025-04-21,Success,Note adult ball human my center.
1097,229,2024-12-19,Failure,Card pressure of until character experience author under.
1098,226,2024-09-24,Success,Despite charge fish serious red I.
1099,596,2024-11-11,Failure,Each property speech position common performance.
1100,803,2024-11-13,Failure,Professional west amount help friend.
1101,435,2024-08-25,Success,Perhaps agree protect fund create.
1102,882,2025-05-20,Success,Development Mrs surface analysis.
1103,758,2024-12-22,Failure,Move surface region church standard base sure.
1104,402,2024-11-11,Pending,Wear common baby see.
1105,622,2024-09-11,Success,Production third represent Mrs thank myself movie.
1106,766,2025-04-12,Failure,Fear across shake body force news.
1107,88,2024-12-07,Failure,Hope writer seek student.
1108,584,2025-05-27,Pending,Amount home now.
1109,893,2025-05-21,Success,Trouble marriage point lose story minute simply.
1110,542,2025-04-11,Failure,Point example thank see simple budget.
1111,684,2025-07-05,Pending,Right design probably born cell us.
1112,309,2025-02-12,Failure,Condition cover admit real.
1113,906,2025-04-03,Success,Expect particularly mother.
1114,343,2025-01-28,Pending,Example magazine memory they.
1115,436,2025-04-21,Failure,Bed television land stay.
1116,177,2025-04-06,Pending,Open order party offer money prepare.
1117,139,2024-12-23,Success,Recognize book near arm themselves institution again.
1118,194,2025-03-16,Pending,Relationship artist girl culture.
1119,186,2025-01-16,Success,Much cover how their.
1120,218,2025-02-18,Failure,Focus another special.
1121,164,2025-08-14,Success,Each morning dog report very.
1122,161,2025-03-22,Failure,Ready understand successful pattern process north particularly.
1123,943,2024-08-22,Failure,Later move it state.
1124,525,2024-12-29,Success,Value tax concern new threat think.
1125,808,2024-12-28,Failure,Participant history smile where Democrat low too.
1126,601,2024-12-20,Pending,Measure play third white.
1127,836,2024-12-30,Failure,Computer lawyer easy need whole board.
1128,42,2025-07-03,Success,Couple professional social cut.
1129,915,2025-02-06,Pending,Response charge pull support room.
1130,210,2024-10-15,Pending,Glass cost say rock as.
1131,741,2025-02-13,Failure,Foot visit save red image time manage.
1132,862,2025-07-15,Failure,Practice institution pick have.
1133,275,2025-06-02,Success,Cold play various mission task spend easy avoid.
1134,954,2025-02-27,Pending,Level know important leave.
1135,279,2024-11-07,Success,Reason good order often mouth east realize.
1136,251,2025-03-12,Failure,Produce condition push wrong state character.
1137,310,2025-05-15,Pending,Heavy receive state move shake particularly.
1138,720,2024-10-23,Success,Offer behind food daughter pattern or.
1139,833,2025-05-06,Success,Gas difference evening itself.
1140,140,2025-01-16,Success,Shake scene though.
1141,792,2024-11-25,Success,Technology against environmental little share include opportunity young.
1142,546,2025-01-21,Success,Share off how again.
1143,821,2024-08-30,Pending,Network other film.
1144,904,2025-05-01,Success,Effort goal pay number if away meeting.
1145,530,2025-07-14,Pending,Soon suggest both left eye learn want gas.
1146,57,2025-03-27,Success,Run movie mouth young fall once.
1147,112,2024-09-17,Failure,Enter firm society.
1148,5,2025-04-20,Failure,Production method house act.
1149,410,2025-02-22,Success,Brother thought all huge.
1150,414,2025-03-23,Failure,Although hundred need top adult name establish.
1151,182,2024-12-30,Pending,Grow bit develop news much.
1152,13,2024-09-19,Success,Couple program American lot project must down.
1153,339,2024-11-06,Pending,Say energy take yes network indeed tend address.
1154,797,2025-06-04,Success,Small trip another defense quickly result service.
1155,259,2025-03-11,Failure,Big thousand sing green data treat.
1156,90,2025-01-08,Pending,Hold best end north stay without.
1157,616,2024-12-14,Failure,It notice me look return.
1158,891,2024-12-09,Failure,President most class.
1159,698,2025-06-05,Success,All piece daughter.
1160,250,2024-12-18,Pending,Thousand but discuss try field why.
1161,255,2025-02-09,Failure,Own visit hotel ever.
1162,588,2025-05-06,Success,Western next upon stand hear feeling.
1163,898,2025-02-15,Success,Help skin call.
1164,971,2024-08-29,Success,Travel particularly job local firm international.
1165,108,2024-10-17,Failure,Contain talk by account.
1166,668,2025-04-17,Success,Democratic play process keep ahead.
1167,594,2025-04-02,Pending,Film too field eye size head development.
1168,589,2024-10-21,Pending,For benefit station discussion different accept.
1169,485,2025-04-17,Failure,Wide explain rock design.
1170,982,2025-01-01,Pending,Reduce technology other about.
1171,972,2025-03-25,Success,Hour probably water us attention.
1172,258,2025-02-01,Failure,Door single century wide manager international establish.
1173,639,2025-01-26,Success,Rule pay new Republican fly foot Congress.
1174,997,2025-06-11,Failure,Color success cause teacher big.
1175,903,2024-08-27,Failure,Within foreign happy base.
1176,282,2025-06-05,Success,Area trouble more PM.
1177,986,2024-12-06,Pending,Final behavior large film likely share.
1178,88,2025-03-22,Pending,Ground center just more sea.
1179,204,2025-06-02,Failure,Born smile leave ground feel.
1180,16,2025-02-24,Success,Least employee suggest owner already discuss member.
1181,151,2024-11-17,Success,Develop by design.
1182,936,2025-01-10,Failure,Them attention cut stay.
1183,254,2025-08-10,Pending,Truth woman interview also listen movement compare.
1184,188,2025-03-14,Success,Attention some lose little act still itself.
1185,329,2024-10-08,Pending,Range finish business reality impact story.
1186,544,2025-01-11,Pending,Unit rock lot south mention.
1187,783,2025-04-10,Failure,Mention tell green rate.
1188,997,2025-07-13,Failure,Fall thank market same kind.
1189,397,2024-10-04,Pending,Value or however usually would difference.
1190,517,2024-09-24,Success,Carry painting either heavy soldier energy.
1191,459,2025-01-18,Success,Apply onto one ahead already answer.
1192,330,2024-11-10,Failure,Never look officer most doctor use remember clear.
1193,820,2024-11-08,Pending,Music important miss toward.
1194,845,2024-09-29,Success,Practice hope save method.
1195,169,2025-03-27,Success,Father seem too prove right old just.
1196,693,2024-12-08,Failure,Treat he simple make play number senior.
1197,366,2024-10-26,Pending,Watch score successful anything.
1198,178,2025-07-19,Success,Author seat leg much.
1199,655,2024-10-18,Failure,Stuff star federal music police trade later bank.
1200,362,2025-06-11,Success,Unit seek more.
1201,760,2025-06-15,Success,Understand specific so some deal.
1202,639,2025-05-30,Success,Set civil yet word bit consider design.
1203,775,2025-01-20,Failure,Decide me sell.
1204,40,2025-03-19,Pending,Box bank early worry man much every.
1205,924,2025-01-23,Failure,Office thought age some prevent term.
1206,416,2025-01-01,Pending,Picture cold black life another firm night.
1207,355,2025-06-05,Success,Under one determine smile become stop.
1208,255,2024-11-10,Pending,Season Mrs again return which activity.
1209,143,2025-01-27,Success,Crime pull after season business drop.
1210,752,2025-08-02,Success,Bag eat tax call of listen care term.
1211,740,2025-04-07,Failure,Building rich amount arrive most step.
1212,853,2024-12-04,Success,Talk response amount foreign.
1213,710,2024-12-20,Failure,Federal research deal attorney.
1214,577,2025-06-13,Pending,Usually somebody most day serious cause.
1215,900,2025-01-06,Pending,Bad real meeting outside nothing decade.
1216,11,2025-04-19,Success,Sometimes art according free focus.
1217,620,2024-09-28,Failure,Bed plan factor program beat free.
1218,26,2025-05-02,Success,Star dream maintain control get theory.
1219,957,2025-07-27,Failure,Here early what party.
1220,421,2025-05-11,Failure,Stuff treat likely consider.
1221,663,2025-04-20,Failure,Talk name instead.
