log_id,employee_id,log_date,status,remarks
412,426,2025-07-19,Pending,System church simply method market difference exist hotel.
413,977,2025-05-23,Pending,Professor reason special grow meeting family.
414,79,2025-08-13,Pending,Individual us some suggest program decision.
415,658,2025-02-16,Pending,Chance choice bag onto brother blue large.
416,919,2025-04-10,Success,Reveal executive four floor.
417,182,2025-04-20,Success,Responsibility itself but popular wall.
418,499,2025-02-10,Pending,Role few remember time prevent hair hospital.
419,798,2025-02-24,Failure,At all table edge cost marriage.
420,762,2024-10-24,Pending,Situation television last staff seat religious.
421,866,2025-02-17,Pending,When seem test contain than clearly.
422,826,2025-06-05,Pending,Indeed main write challenge this.
423,708,2025-07-23,Failure,Mention manager everyone dark Congress.
424,835,2025-04-26,Failure,Side place represent.
425,71,2025-06-05,Failure,Health able lot station may decision forward probably.
426,248,2025-03-17,Success,Event hospital more opportunity unit cultural show.
427,146,2025-06-27,Failure,Lawyer rest natural.
428,618,2024-09-27,Success,You lead expect adult operation whole artist.
429,775,2024-09-01,Success,Upon trial participant discuss firm opportunity.
430,296,2025-01-08,Failure,Enter through system stage protect often house.
431,582,2024-08-29,Failure,Most American weight.
432,470,2025-04-13,Failure,Dream able answer away sort movement tonight.
433,506,2025-07-31,Success,Administration than run short small shoulder.
434,193,2025-05-22,Pending,Market oil move.
435,68,2024-10-16,Failure,Explain break dog writer night forget nation.
436,494,2025-05-19,Failure,Add involve forget early look.
437,817,2025-05-30,Failure,Candidate see election price.
438,52,2024-10-25,Success,Indeed town daughter clearly best.
439,882,2025-07-22,Success,Finally my nature attention work.
440,363,2025-07-14,Pending,Table about dream single.
441,797,2024-10-08,Failure,Whole box later building she.
442,917,2024-09-19,Success,Let business property everything bar smile good.
443,474,2025-01-27,Pending,Southern nation economy adult trial source.
444,846,2025-07-07,Failure,Yeah class garden miss.
445,521,2025-07-12,Success,Create yard serious goal future home series.
446,763,2024-10-03,Failure,Southern simply I cold.
447,431,2024-09-08,Failure,Point similar security at year dinner prevent tree.
448,844,2025-02-06,Success,Newspaper leader focus hard tonight already could.
449,298,2025-04-22,Success,Green write value possible indeed study wide.
450,435,2025-05-20,Success,Be successful organization no bring career manager.
451,696,2024-09-11,Failure,Rise future person allow structure first fine.
452,691,2024-12-18,Failure,Fall teach area feel who carry.
453,198,2024-09-24,Pending,Staff yourself exactly sure wonder.
454,128,2025-07-17,Failure,Hair marriage school imagine ago expect continue.
455,532,2025-03-17,Success,Thank use owner surface.
456,984,2024-12-03,Failure,Box window should five buy office.
457,411,2025-07-15,Pending,Song discuss everybody success nearly must teacher speech.
458,934,2024-11-01,Pending,Very that national trade price beyond idea.
459,840,2025-04-29,Success,Find there behavior.
460,65,2025-04-13,Success,Especially appear attention we open blood.
461,694,2025-05-31,Pending,Amount special image blood city vote time.
462,241,2024-08-24,Pending,Bank collection possible notice term.
463,369,2024-12-25,Pending,Speech like rock call scene state radio draw.
464,536,2025-07-09,Success,Accept mission event some simply could.
465,384,2025-05-05,Pending,Draw involve party home stay fall carry.
466,431,2025-07-13,Pending,In official especially pattern threat religious effort painting.
467,967,2025-08-02,Success,Within if course.
468,83,2024-12-18,Failure,Reality office sport oil whose.
469,982,2025-08-01,Failure,Car American your seat rule.
470,831,2025-05-20,Pending,Card design where off prepare response.
471,697,2024-10-22,Failure,Including game language.
472,951,2025-08-04,Failure,Right size than foot.
473,828,2025-04-02,Failure,Her million every production tax certainly.
474,611,2025-05-25,Failure,Good thank teach production majority we.
475,574,2025-01-07,Pending,Any able less article threat arrive.
476,286,2025-03-06,Failure,Modern data book expert exist computer shoulder.
477,989,2024-08-23,Failure,Size morning only girl popular last read.
478,534,2025-08-18,Success,Style white especially lose just.
479,459,2025-05-03,Pending,Admit doctor magazine despite.
480,212,2025-01-21,Success,Meeting value body return miss ready even.
481,126,2025-01-26,Success,Son second after note those drop executive.
482,413,2025-07-09,Pending,Serious protect new party sometimes.
483,499,2025-05-04,Failure,Two physical within about when force ready.
484,425,2025-05-05,Success,Information game loss cost run result interesting.
485,554,2024-09-10,Pending,Only pick prove whether north.
486,610,2024-09-12,Failure,Benefit line cultural each animal from.
487,961,2024-10-31,Pending,Serve mouth manage issue none ready billion.
488,543,2025-07-04,Success,Discuss term day include.
489,158,2025-06-09,Failure,Bill wrong nature responsibility.
490,112,2025-02-28,Failure,Scene despite best either truth.
491,402,2024-10-14,Pending,Build exactly open last decide future.
492,759,2025-05-28,Failure,Partner behavior economy our second.
493,122,2024-11-29,Success,Analysis ready must price receive.
494,273,2024-09-19,Success,Unit majority yeah.
495,294,2024-10-24,Success,Thought beyond mean director offer a.
496,398,2025-02-06,Pending,Various send news clearly school wonder.
497,471,2024-09-04,Failure,Again every common church scene run cultural.
498,985,2024-12-03,Failure,Culture far article last peace.
499,207,2025-04-11,Failure,Brother treatment daughter.
500,110,2024-11-03,Success,Series seven strong it reach street city her.
501,440,2025-05-12,Failure,Hear mouth range throw.
502,278,2025-03-02,Success,Be church available indeed.
503,963,2025-01-23,Failure,Director spend entire minute never quality.
504,568,2024-10-24,Success,Together true worker though church young mouth note.
505,887,2025-04-21,Failure,Interesting particularly some evidence employee degree safe.
506,915,2025-06-04,Pending,Cultural far significant.
507,569,2025-07-11,Pending,Until themselves break reason too discover record.
508,940,2025-07-09,Success,Nice house power Republican.
509,482,2025-08-18,Success,Apply conference then sometimes.
510,803,2024-08-19,Failure,Traditional meet parent this drop.
511,114,2024-12-16,Failure,Base modern behavior end nature stock analysis.
512,893,2024-12-02,Pending,Sure day sort determine player military person.
513,897,2025-03-23,Failure,Instead plant bag set.
514,820,2025-01-01,Success,Clearly everybody suggest air she sister simple.
515,853,2024-10-02,Success,Television rich base.
516,477,2024-12-28,Success,Serious space one bar.
517,710,2025-02-15,Success,Lose south keep thus positive.
518,933,2025-03-26,Success,Skin security painting rest.
519,321,2025-07-08,Pending,Fine public some mean face factor.
520,179,2025-05-15,Pending,Be spend outside office.
521,897,2024-09-20,Success,Expert mission should character station eye perform.
522,219,2025-03-25,Failure,Fire light medical.
523,789,2025-08-14,Success,Ago out able end early generation game.
524,949,2025-02-13,Pending,Rich every change help but include.
525,528,2024-09-21,Success,Memory wrong hard any financial.
526,492,2024-10-02,Pending,Size heart among research.
527,891,2025-08-09,Pending,Like image drive own pass least great your.
528,61,2024-09-22,Success,Single well task moment call art soon up.
529,54,2024-10-27,Success,Education more three trip school energy.
530,680,2025-05-28,Failure,While popular natural list they.
531,538,2024-09-20,Pending,Middle her shake month ask.
532,848,2024-10-29,Failure,Drug pull center hundred question.
533,988,2024-12-19,Success,Miss population project film.
534,65,2025-04-04,Pending,Citizen drug information response happy.
535,612,2025-04-18,Failure,Issue bit whether edge left American hope.
536,586,2024-08-25,Failure,Hope great seek serious term amount idea director.
537,704,2025-06-11,Failure,Future raise family where treatment age.
538,171,2024-10-22,Success,Like film society tell.
539,273,2025-06-20,Success,Office spring measure truth sign room happy.
540,889,2024-08-22,Success,Recently million store every rise care particular.
541,699,2024-11-10,Pending,Purpose future face police.
542,535,2025-04-22,Success,Draw trouble decade share great.
543,391,2025-01-10,Pending,Election fire remember house develop center bill.
544,940,2025-02-12,Failure,Represent lawyer letter these.
545,693,2024-09-18,Failure,Name paper cup order.
546,327,2025-07-24,Success,Quickly manage care popular yourself always image alone.
547,108,2025-05-26,Failure,What truth partner measure.
548,847,2024-11-21,Success,Yard believe whether teach single result.
549,162,2024-12-15,Pending,Through action continue star young ahead blood.
550,814,2025-07-09,Failure,Born campaign others under each help.
551,452,2025-05-09,Success,Pm market role statement other whether traditional.
552,206,2025-04-24,Failure,Think quite hot.
553,590,2025-08-03,Failure,Society care around find audience but moment sign.
554,16,2025-07-19,Success,Board factor discuss morning gas.
555,327,2024-10-31,Failure,Only series imagine.
556,608,2025-06-04,Failure,Spring citizen democratic own.
557,659,2025-06-07,Failure,Available later friend industry.
558,2,2025-05-31,Failure,Effort already second room.
559,10,2024-10-08,Pending,Mind imagine section stop.
560,434,2024-12-16,Failure,Again society down very investment whom season mind.
561,125,2024-09-07,Failure,Bring can sister adult.
562,81,2025-01-12,Success,Want themselves area.
563,485,2025-05-19,Pending,Guess huge parent stand several.
564,652,2024-12-07,Success,Child lay fly seat beyond compare.
565,838,2024-10-26,Success,Effect future appear involve nearly.
566,150,2024-12-04,Success,Occur magazine suggest interesting no total.
567,800,2024-10-11,Pending,Decision modern enough see American drug to above.
568,873,2025-03-25,Success,World sister garden down television tree say.
569,340,2024-12-18,Success,Carry animal do hear rich apply project.
570,129,2025-01-25,Success,Reality adult state medical year oil ask.
571,438,2024-11-13,Failure,Experience consider administration yet yeah.
572,751,2025-07-08,Success,Southern idea our of wall inside person space.
573,501,2024-10-30,Pending,Store politics service second put.
574,58,2024-12-01,Pending,Bed mission certain situation often PM notice.
575,198,2025-07-27,Failure,Form bill again matter.
576,211,2024-11-03,Pending,Notice society task well three.
577,914,2024-10-25,Pending,Continue sister standard family.
578,902,2024-12-10,Failure,Simply involve nor whether.
579,45,2024-11-26,Success,Imagine record wrong list.
580,97,2025-05-15,Failure,Policy lead individual through politics community.
581,279,2025-02-04,Success,Finally wall right mind determine.
582,535,2024-11-28,Success,Traditional practice together minute price night admit standard.
583,410,2024-09-22,Pending,Stock today whether thought brother.
584,461,2025-02-24,Failure,Total not its air.
585,391,2025-01-02,Pending,Image several name chair.
586,847,2025-03-30,Pending,Behavior nearly of general piece.
587,44,2025-01-06,Success,Address loss international public rate.
588,27,2024-12-31,Pending,Short southern finish front.
589,794,2025-06-13,Failure,Edge court environment must.
590,97,2025-04-24,Pending,Onto significant sure evening together.
591,975,2025-03-09,Pending,Strategy clearly sell.
592,548,2025-02-08,Success,According system its.
593,621,2025-07-06,Failure,Traditional home your bring woman hit.
594,567,2025-04-20,Pending,Avoid property sport friend wide.
595,704,2025-05-11,Success,Answer at month.
596,219,2025-07-07,Pending,Possible bag picture available scene approach imagine concern.
597,185,2024-10-23,Failure,Miss the we politics phone anyone happy point.
598,69,2024-09-01,Pending,Admit manager kind example class.
599,829,2025-07-08,Pending,Those rise several in candidate case affect.
600,130,2025-04-02,Success,Second man personal listen.
601,567,2025-01-14,Pending,Type word not usually at sing.
602,890,2024-10-17,Success,However model move.
603,609,2025-03-14,Failure,Wife cup law become.
604,848,2025-03-26,Pending,West fire resource commercial.
605,599,2024-11-07,Failure,Trouble husband level until less daughter.
606,806,2025-05-17,Failure,Question bad clear here.
607,631,2025-02-02,Pending,Seek draw message prove car.
608,720,2024-12-30,Success,National with heavy couple language through nation.
609,334,2025-04-25,Failure,Enough any which ten follow.
610,925,2025-06-28,Failure,Ten family amount stage.
611,154,2025-05-09,Pending,Every yet door daughter economic big.
612,547,2025-06-23,Pending,Move until toward scientist matter message trip.
613,79,2024-12-08,Pending,Add claim begin man.
614,579,2024-11-06,Pending,Movie consumer pick end us information occur future.
615,855,2024-12-28,Pending,Six rather just serious term discuss state.
616,413,2025-05-16,Pending,Theory summer concern race five.
617,546,2025-03-01,Success,Full occur last.
618,609,2025-03-20,Failure,Manage reflect name.
619,169,2025-07-06,Success,Idea until budget long article team.
620,681,2025-06-02,Success,Door if sister chair society half able.
621,663,2025-06-22,Pending,Century probably color difference glass purpose beat.
622,583,2024-11-30,Failure,Quickly process address friend writer view.
623,515,2024-09-22,Success,If change authority prepare view.
624,314,2025-03-05,Pending,Word catch nothing why.
625,32,2025-06-14,Pending,Western newspaper move radio dog perhaps my situation.
626,287,2024-11-07,Failure,Well camera truth.
627,594,2024-11-26,Success,Sometimes week reality discover success item.
628,43,2024-11-10,Success,Respond economy why possible fear paper suffer particular.
629,903,2025-02-15,Success,Picture positive exist later nation leader special.
630,617,2024-11-27,Pending,Receive kid ground.
631,1,2024-08-30,Failure,Dog name language local.
632,573,2025-08-11,Failure,Shoulder prevent ago past ever sister white.
633,270,2024-10-01,Success,Rest professional left particular.
634,180,2025-03-06,Pending,His change perhaps trip media responsibility child.
635,736,2025-04-30,Success,Floor officer management seek.
636,518,2025-04-20,Failure,Five modern human control personal down appear.
637,103,2024-10-29,Pending,Third professional test sense hope.
638,10,2025-02-18,Success,Forward lead although pull collection tonight compare second.
639,583,2024-10-11,Success,Environmental consumer model leave hour cell.
640,90,2025-02-15,Pending,Family point plant card mouth office especially hot.
641,226,2025-04-02,Failure,Term create whether type various.
642,670,2024-12-21,Pending,If end range trouble cost seven.
643,740,2025-01-09,Success,Concern war home why commercial watch develop.
644,917,2025-03-24,Success,Gas part rather bill team.
645,126,2025-01-11,Success,Blood represent hard agent position million what.
646,956,2025-04-30,Success,Food particular series significant expert energy account.
647,209,2025-04-03,Failure,Physical build push mention officer.
648,97,2025-08-03,Failure,Trial out close current.
649,74,2024-08-31,Success,Old especially also stuff decision film.
650,627,2024-12-21,Failure,Family blue still dark describe community.
651,191,2025-05-17,Failure,Though stage live suffer modern draw international surface.
652,682,2024-09-27,Failure,Administration per well.
653,819,2025-04-19,Success,Recent poor board wear.
654,960,2025-01-04,Pending,Along government lead past.
655,716,2025-07-21,Pending,Receive model no painting.
656,56,2025-08-02,Pending,Serious according guess dog.
657,720,2024-08-21,Success,Money task give clear carry former speak.
658,553,2024-10-18,Failure,Indicate western tell on indeed senior.
659,32,2025-01-28,Failure,Kind fear cold manage full front scientist.
660,527,2025-02-18,Success,Must fund open who someone.
661,574,2024-12-25,Success,Skin success explain maybe fight pass.
662,667,2024-12-26,Pending,Whose speech into forward.
663,284,2025-04-26,Pending,Usually according always choose.
664,721,2025-08-03,Success,Head director positive discussion when.
665,832,2024-09-25,Pending,Poor stay yard break.
666,494,2024-10-29,Failure,Than attorney accept future almost daughter.
667,187,2025-08-07,Success,New consider beyond field surface modern.
668,498,2025-01-04,Success,History people respond century white real.
669,442,2024-12-14,Failure,Institution together small rest fall.
670,130,2024-10-20,Failure,Change according hand middle school cold.
671,639,2025-02-15,Failure,Explain wear attorney despite spend remain.
672,292,2025-03-18,Pending,Say couple as customer.
673,114,2024-10-29,Success,These population phone perhaps.
674,199,2025-06-06,Pending,Help account bed each.
675,13,2024-08-26,Failure,Majority daughter need generation mouth.
676,271,2025-02-04,Pending,Identify relationship professor computer Congress glass less.
677,601,2025-06-28,Failure,Section guy physical low her.
678,215,2025-04-14,Pending,Walk foot peace memory simply prove law.
679,444,2025-02-11,Pending,Drop bill apply than responsibility whether population.
680,790,2025-04-05,Failure,As reach cup skin.
681,512,2025-03-29,Pending,Understand pretty whom what unit.
682,447,2025-05-14,Success,Consider choice western travel degree in.
683,986,2025-02-02,Pending,Western run son price.
684,993,2025-05-28,Pending,Away field network century to foot hair who.
685,715,2025-01-20,Success,Talk music floor vote environment business right.
686,74,2025-02-17,Failure,Say think despite space face walk number.
687,537,2025-07-07,Success,Tend officer well marriage resource.
688,101,2024-11-20,Pending,Congress land station team.
689,176,2024-11-24,Failure,Able number key class former project.
690,427,2025-05-25,Pending,Life money marriage both make time force often.
691,117,2025-01-09,Pending,Watch million candidate agreement push will care.
692,166,2025-04-08,Success,However so television nature community third.
693,41,2024-12-27,Success,Set major specific rather letter.
694,429,2025-02-21,Failure,Media notice glass decision science relate head.
695,344,2025-05-08,Failure,Group door movement under sometimes two so.
696,424,2025-01-20,Failure,Dark everything few.
697,366,2024-12-12,Pending,Population spring talk off body at.
698,120,2024-09-02,Success,West the now up.
699,609,2025-08-13,Success,Age chance officer single.
700,657,2025-07-24,Success,See professional begin current everyone test memory arm.
701,728,2024-11-16,Failure,Treatment office yeah bar rather.
702,229,2025-06-10,Success,Behavior whose certain any character charge debate.
703,825,2025-08-16,Success,Term under whether improve.
704,130,2025-08-02,Success,Apply paper second become.
705,352,2025-08-12,Failure,Him bit tree among.
706,889,2025-03-02,Success,Return land rich product understand service usually cup.
707,318,2024-09-28,Failure,Section degree family court herself decade add condition.
708,984,2025-01-28,Success,Since billion share example beyond.
709,649,2025-01-30,Success,Age next house modern two.
710,836,2025-06-14,Success,Office force care.
711,337,2024-11-30,Failure,Expert can style option red happen whose return.
712,273,2025-03-30,Failure,Special save ability us.
713,117,2025-01-20,Success,Other campaign reason market admit best why.
714,818,2025-04-05,Pending,Center course very near.
715,368,2024-08-29,Failure,Happen film under deep agree walk thousand.
716,94,2024-10-20,Failure,Agent wrong us institution.
717,168,2025-03-04,Success,Pass look newspaper everyone coach people.
718,954,2024-10-21,Pending,Responsibility who issue technology against direction.
719,715,2025-08-11,Success,Team most war blood.
720,341,2024-12-12,Failure,End tell still range politics develop.
721,661,2025-07-28,Failure,Allow around admit guy toward.
722,914,2025-04-06,Success,North shoulder later institution skin performance he.
723,695,2025-05-15,Success,Quality your head interesting common early look blood.
724,925,2025-03-09,Pending,Left able analysis arrive budget.
725,152,2024-11-03,Pending,But debate south say include discover last.
726,586,2025-03-26,Failure,Shake bed class might name.
727,877,2025-06-05,Pending,Best risk hand blue or than board.
728,913,2024-10-11,Pending,Region less crime amount laugh east.
729,274,2024-10-07,Failure,Republican forward why spend explain wide west.
730,554,2025-05-02,Failure,Feel song company region agent north consider.
731,496,2024-12-25,Failure,Teacher put land region other many daughter.
732,724,2025-06-20,Failure,Accept current provide the customer I state.
733,101,2024-09-07,Success,Two stuff threat join chance good.
734,557,2024-09-22,Failure,Modern store record little.
735,82,2024-12-16,Failure,Arm entire increase.
736,529,2025-06-21,Failure,Financial form operation sense.
737,73,2025-06-11,Pending,Anything open project buy.
738,14,2024-10-11,Failure,Also see enjoy door should.
739,433,2025-06-25,Success,Attack resource serious teach piece especially able.
740,157,2024-12-30,Success,Property remain first common eight.
741,735,2025-02-12,Failure,Maybe space father store start upon house paper.
742,132,2025-01-18,Success,Police possible cup opportunity rate sport him.
743,338,2024-10-21,Pending,Seek bill traditional western chance machine weight.
744,404,2025-02-12,Failure,Look entire do company focus consumer say.
745,376,2024-08-18,Success,Prove organization old treatment yet land address.
746,888,2025-04-30,Success,Close issue write produce ago.
747,559,2024-10-14,Failure,Anything leave tough such black improve subject.
748,107,2024-11-03,Success,Piece produce else.
749,620,2025-07-26,Failure,Want son dog range seem number other.
750,265,2024-10-23,Success,Large chair born wish while room Mr personal.
751,205,2024-12-13,Pending,Until meet spring surface wife.
752,79,2024-12-15,Success,Thus fight catch serious later they.
753,155,2024-09-18,Success,Miss scene do work win health.
754,783,2024-10-28,Failure,Much article agent.
755,988,2024-11-17,Success,Another listen list behavior successful success herself.
756,997,2025-07-17,Failure,Federal idea share property.
757,247,2024-11-04,Pending,Memory matter stage establish.
758,531,2025-02-03,Failure,Outside interest tough character.
759,858,2024-09-22,Failure,Official yourself us local play environment.
760,948,2025-05-26,Success,Great require else so so interest great analysis.
761,538,2024-11-21,Pending,Politics computer exist throw real next four.
762,729,2024-10-16,Failure,Government single least something source prove.
763,154,2025-05-10,Success,Consider policy those unit reduce executive.
764,154,2025-03-21,Success,Heavy national result very investment enter memory charge.
765,686,2025-07-12,Failure,Activity night bill central wonder green.
766,92,2025-06-15,Success,Stay image my by maybe.
767,433,2025-01-10,Failure,Whether single entire hundred recent direction American.
768,338,2024-08-19,Failure,Case else look wrong send knowledge.
769,480,2025-02-19,Failure,Attention against strategy become available your both.
770,693,2024-10-18,Pending,Group sense outside spring your.
771,131,2024-12-29,Failure,Resource blue degree rest thus.
772,450,2024-09-25,Success,Cost eat truth fly memory hundred.
773,993,2025-02-16,Pending,Travel growth what.
774,810,2025-03-19,Success,Many energy pattern investment practice.
775,787,2025-05-11,Pending,Recent event skin indicate suddenly.
776,273,2025-01-18,Pending,Sense machine treatment section significant camera else.
777,929,2025-05-16,Pending,Of national among must traditional able husband.
778,588,2024-11-08,Pending,Certainly even kitchen including summer bit difficult.
779,177,2025-08-07,Success,Performance try phone water national pattern.
780,696,2025-02-17,Failure,Pay trip recognize ok recent near find.
781,831,2025-05-04,Success,High fine throughout bed future end finish.
782,643,2025-01-11,Failure,Book party reveal.
783,875,2025-07-06,Success,Around reach local guess.
784,49,2025-02-13,Pending,Threat and box listen institution rock.
785,567,2025-05-19,Pending,Strategy Mrs side space debate.
786,666,2024-11-20,Failure,Eat wish positive beyond often foreign.
787,355,2025-06-10,Failure,Argue magazine any order prepare feeling career morning.
788,712,2025-08-09,Success,Economic another turn your radio ever total technology.
789,308,2024-09-24,Failure,Itself marriage anyone smile energy add so financial.
790,868,2025-01-15,Success,Tend majority kitchen Mr ahead late.
791,885,2024-10-06,Failure,Should who court media part.
792,630,2024-12-19,Failure,Capital tax hard sometimes then situation.
793,775,2025-06-10,Failure,Side from eye board.
794,46,2025-08-16,Pending,Free part director approach reason push civil cost.
795,302,2024-10-08,Pending,Charge Congress seven later.
796,868,2025-01-20,Success,Really listen husband shake party hope billion.
797,912,2025-06-14,Failure,Exactly work begin treat.
798,408,2024-12-23,Success,Spring economy someone police year accept toward.
799,189,2025-08-01,Failure,Address listen might how represent yard campaign.
800,822,2024-12-05,Pending,Common other walk know.
801,830,2025-07-02,Pending,Us event care.
802,129,2025-05-07,Failure,Society table police interesting challenge book.
803,561,2025-05-28,Failure,Apply more director service.
804,537,2025-07-22,Pending,Garden involve recent role term mother leave.
805,266,2025-01-29,Pending,Wind player happy enter method finally.
806,118,2025-04-06,Success,Public reason discussion food.
807,464,2025-01-17,Pending,Gun sell wear another put.
808,144,2025-03-13,Failure,Effort present expect level science thank.
809,442,2024-09-14,Success,Born war child require.
810,200,2024-12-30,Failure,Experience Mr she room man vote safe.
811,157,2025-02-23,Success,Late top huge deal.
812,487,2025-05-05,Failure,Population question coach college court.
