log_id,employee_id,log_date,status,remarks
1222,221,2025-06-09,Pending,Important gas economic computer bank southern.
1223,853,2025-04-22,Failure,Attention relate include alone bit.
1224,496,2024-12-19,Pending,Where follow through friend the play federal.
1225,237,2025-03-01,Failure,Amount health buy country nice.
1226,237,2025-03-14,Pending,Career woman across.
1227,219,2025-03-12,Pending,Main decade care tax.
1228,487,2025-01-17,Pending,Enjoy else establish break.
1229,936,2024-11-13,Success,Discover first deep again in something industry I.
1230,461,2025-07-17,Failure,Phone reality about community measure shake everything party.
1231,663,2025-01-21,Success,She that senior go talk down story.
1232,635,2025-02-26,Failure,Mrs throughout career make law thousand.
1233,144,2025-06-07,Failure,Politics interesting need.
1234,990,2025-02-14,Success,World small serious stuff star simply she.
1235,189,2024-12-07,Pending,Data water opportunity.
1236,255,2025-07-04,Failure,Top medical day like prepare grow mention.
1237,68,2025-08-12,Pending,Democrat exist little add economy.
1238,616,2025-02-08,Success,Response painting performance both week.
1239,336,2024-10-17,Pending,Mention PM industry age nation.
1240,671,2025-08-11,Failure,Card enough cold always energy pretty.
1241,821,2025-07-23,Failure,Television discussion be alone.
1242,874,2024-10-25,Failure,Late care environmental evidence after religious.
1243,409,2025-01-20,Success,Ready stuff evening north city he sit.
1244,300,2024-12-08,Failure,Poor arrive lot pattern better plant certain.
1245,908,2024-08-19,Success,Name letter onto save listen.
1246,602,2025-03-12,Pending,Work tend off daughter concern back.
1247,357,2025-07-06,Failure,Success soldier control add strategy really pull.
1248,256,2024-12-25,Failure,Information blue stock appear.
1249,353,2025-06-10,Failure,Figure moment between high anyone.
1250,732,2025-02-14,Pending,Chance human reason.
1251,521,2025-04-29,Failure,Argue upon single all.
1252,524,2024-10-23,Success,Single door throw increase career number.
1253,837,2025-05-10,Pending,Important myself all fund little.
1254,950,2025-08-05,Pending,Air benefit during four something whole.
1255,756,2024-09-25,Pending,Sometimes democratic left.
1256,694,2025-01-13,Pending,Sell alone later civil board.
1257,284,2025-03-31,Pending,Spend not sea line away hope central.
1258,312,2025-04-28,Success,Agent statement first two.
1259,99,2025-01-27,Pending,Sea society your book cold.
1260,197,2025-01-27,Failure,Listen according either each.
1261,482,2025-01-24,Pending,Work certain difficult.
1262,878,2024-10-30,Pending,Fall skill total contain certain.
1263,226,2025-04-22,Pending,Address garden Democrat onto sense center.
1264,845,2024-08-29,Pending,On figure statement.
1265,615,2025-04-15,Pending,Third heart against purpose inside personal firm.
1266,618,2024-11-13,Success,Type like bad letter stand.
1267,365,2024-10-10,Success,Agency wife care way still grow music.
1268,368,2025-04-11,Pending,Him capital blood property.
1269,570,2025-04-15,Success,Western Mr two before south music.
1270,590,2025-03-01,Failure,Year reflect run sort those effort.
1271,75,2024-09-18,Pending,Into these wonder purpose camera less yourself.
1272,42,2025-04-07,Failure,Matter especially lay.
1273,422,2025-03-27,Failure,Memory discuss start.
1274,836,2025-05-29,Pending,With with body allow factor suffer candidate.
1275,181,2025-01-23,Failure,Feeling anyone number risk more statement.
1276,545,2024-08-26,Failure,Hotel while personal street size.
1277,71,2024-12-22,Failure,Everything especially join last week.
1278,568,2025-04-11,Pending,Citizen difference whole improve ever could research.
1279,105,2024-11-23,Pending,Collection young current.
1280,200,2024-10-21,Failure,Rather sea term grow forget these seven.
1281,101,2025-03-27,Pending,Article adult million.
1282,768,2025-04-17,Pending,Soldier season yes law order.
1283,307,2025-02-17,Failure,Above might occur sing yourself building budget sometimes.
1284,586,2025-05-10,Pending,Often task begin.
1285,683,2024-09-22,Success,Send physical star catch manager value score.
1286,377,2025-01-08,Pending,Pull war officer least respond and across somebody.
1287,655,2024-08-26,Success,Feel writer week wall term natural.
1288,678,2025-06-02,Failure,Yourself home American age others subject operation.
1289,399,2025-04-08,Pending,Range eat budget benefit strong.
1290,773,2025-07-27,Failure,Bar benefit think five product new hard.
1291,221,2025-06-20,Failure,Form center of source change.
1292,595,2025-04-29,Failure,Country employee summer.
1293,182,2025-01-16,Failure,Attention data several.
1294,307,2025-03-20,Failure,Include air focus want parent.
1295,522,2025-03-04,Pending,Exist three event identify kid.
1296,396,2025-07-19,Success,Believe nearly environment.
1297,4,2024-10-31,Pending,Special relationship much.
1298,863,2025-07-14,Pending,Read charge case development.
1299,914,2025-08-07,Pending,Others short why chance three cell most.
1300,848,2024-10-19,Pending,Thought market read toward life smile grow.
1301,1000,2025-02-11,Success,In civil us general lawyer.
1302,804,2025-01-08,Pending,Far city behind.
1303,281,2025-05-25,Failure,Wear necessary forward near rather voice pick.
1304,215,2025-07-23,Pending,Window generation adult program throughout boy all let.
1305,972,2024-11-18,Pending,Despite enough impact approach.
1306,610,2024-10-25,Success,No mission leader ahead.
1307,420,2025-02-17,Success,Customer tough nothing wrong.
1308,101,2025-08-16,Failure,Interview go by pressure enough mother hear marriage.
1309,963,2025-05-21,Pending,Itself foot what sign room wind.
1310,521,2025-08-10,Pending,Fine rise wife figure concern.
1311,573,2024-11-03,Pending,Without industry despite plant.
1312,309,2024-12-21,Failure,Stay agent performance four according material.
1313,658,2024-10-08,Success,Work who finally suddenly else glass which bar.
1314,939,2024-12-09,Failure,Movement clear fish big quickly step.
1315,931,2024-09-12,Pending,Hour would meeting suggest.
1316,510,2025-07-31,Success,Various use situation well task everybody.
1317,63,2024-08-29,Success,What perform kind young.
1318,633,2024-11-06,Failure,Kind task especially perhaps list stop production.
1319,226,2025-03-30,Success,Art debate address include usually south field not.
1320,105,2025-02-13,Success,Wind by finish even decide.
1321,974,2025-02-12,Pending,Film information school.
1322,772,2024-11-21,Pending,Natural water character from PM such.
1323,861,2025-05-10,Success,Scene green ground offer common wide process everybody.
1324,425,2025-04-09,Success,Poor because buy provide partner.
1325,255,2025-02-06,Failure,National bag chair eat tax.
1326,429,2024-11-19,Failure,Do different quality smile matter tell.
1327,434,2025-06-23,Success,Right month everyone soon.
1328,207,2024-10-25,Pending,Age if employee similar girl better beyond.
1329,28,2025-02-13,Success,Consider claim there.
1330,682,2025-02-28,Success,Cultural seek bank risk east.
1331,336,2025-04-24,Pending,Budget husband financial.
1332,588,2024-09-30,Pending,Interest statement dream central require politics measure.
1333,628,2025-06-26,Failure,Would dark artist.
1334,69,2025-04-09,Failure,Bit land stock performance treatment.
1335,866,2025-07-09,Failure,Bag space allow.
1336,746,2024-12-24,Failure,Decide try little.
1337,513,2025-07-22,Pending,Drive seek many between.
1338,167,2025-08-10,Success,Seven never animal see this serious this.
1339,864,2025-08-05,Failure,Set vote raise pattern.
1340,730,2024-10-18,Failure,Return election ok.
1341,785,2024-11-21,Pending,Suddenly player start forget half.
1342,368,2025-02-13,Pending,Pick baby when.
1343,251,2025-05-25,Success,Development morning relationship against two newspaper.
1344,859,2024-09-14,Success,Mission about case life set resource.
1345,856,2024-08-20,Pending,Born indeed interview need mention single like.
1346,931,2025-06-04,Failure,Candidate dark other serve.
1347,686,2024-08-30,Failure,Edge make building cup fund dinner.
1348,170,2025-05-09,Failure,There nice black total consider expert address.
1349,758,2025-05-07,Success,Hand goal term matter address prepare protect.
1350,935,2025-01-22,Failure,Create should degree house control.
1351,90,2025-07-20,Failure,Hospital also year own.
1352,561,2025-03-07,Pending,Necessary suggest employee project after song.
1353,446,2025-02-16,Failure,At people brother official work use.
1354,294,2025-07-18,Pending,Become area break image.
1355,919,2025-01-14,Failure,Statement home above until design.
1356,150,2024-09-14,Success,Another wait spend mission election site.
1357,132,2025-06-18,Failure,Summer reflect reason per tend.
1358,433,2025-01-26,Failure,Carry my fall at age feeling blue.
1359,59,2024-11-26,Pending,Over special sport first director challenge.
1360,969,2025-07-27,Pending,Treatment help rest shake research writer.
1361,836,2025-05-23,Pending,Identify some discuss test pass.
1362,199,2025-03-14,Failure,Discussion nearly behavior for star they.
1363,215,2024-10-03,Failure,Treatment inside shoulder choice measure.
1364,898,2025-05-22,Success,Skin talk business line necessary fly share ten.
1365,561,2025-06-15,Failure,National baby last manage.
1366,472,2025-04-10,Success,Care or share marriage.
1367,744,2025-04-26,Pending,Game employee heavy voice.
1368,247,2025-03-13,Pending,Several speech left.
1369,382,2025-05-22,Pending,Same affect fast fall serve.
1370,991,2024-08-27,Success,Sign institution leg center group kid.
1371,239,2025-02-04,Failure,Leave article matter.
1372,927,2025-02-20,Pending,Gun south senior lose.
1373,367,2025-07-05,Failure,Loss reveal describe main fill.
1374,168,2025-05-26,Failure,Morning simply thousand fast authority.
1375,560,2024-09-10,Pending,Me food learn Congress anyone.
1376,51,2024-12-09,Success,Common employee seem rate idea challenge late.
1377,811,2025-06-29,Failure,Might feel animal indicate economy act present.
1378,610,2025-01-19,Pending,Raise century watch teacher relationship wall.
1379,951,2025-07-05,Failure,Risk whom husband individual catch.
1380,728,2025-07-03,Failure,By throw issue mean little appear time really.
1381,689,2025-05-26,Failure,Military very year option do.
1382,380,2025-06-12,Failure,Really sister since employee.
1383,474,2024-09-02,Failure,Small reach want page certain customer.
1384,80,2025-01-06,Success,Score whatever force table investment either.
1385,697,2025-01-20,Success,Fire radio scene.
1386,367,2025-05-23,Pending,Late say matter think matter fund.
1387,461,2025-08-13,Success,City sure only television drop.
1388,911,2025-03-04,Success,Employee suddenly local team see candidate rock.
1389,539,2025-04-19,Success,Arrive compare want chair.
1390,452,2025-04-27,Failure,Blood avoid let he.
1391,464,2025-02-04,Failure,International building man institution arm family pattern.
1392,960,2025-01-31,Pending,Head eye student identify network allow compare.
1393,478,2025-06-19,Pending,Structure western account once.
1394,926,2024-10-05,Pending,Cost together section yet.
1395,420,2024-09-27,Failure,Some add you three continue however many.
1396,707,2024-10-13,Success,Art national than late.
1397,214,2025-07-12,Success,Tv south ball.
1398,369,2024-11-27,Failure,Knowledge sing thousand rate walk.
1399,854,2025-06-08,Pending,On decade including learn effect.
1400,114,2025-07-04,Pending,Heavy difference both space civil.
1401,754,2025-03-31,Pending,Site item drop new music.
1402,503,2025-06-06,Failure,Allow huge upon employee choose glass rock.
1403,636,2025-06-21,Pending,Foot recognize despite painting camera red yard.
1404,817,2024-09-30,Pending,Conference technology civil occur state develop present.
1405,588,2025-05-25,Failure,Window none investment by involve.
1406,311,2024-10-22,Success,Laugh position station law coach popular.
1407,469,2025-01-07,Failure,With open enter see only age.
1408,824,2025-01-25,Failure,Media national feeling.
1409,708,2025-04-29,Failure,Industry manager guy.
1410,863,2024-12-27,Failure,Suffer against and act resource billion.
1411,44,2024-10-12,Success,Organization coach sign tough.
1412,415,2025-08-07,Pending,Think draw allow else occur.
1413,698,2024-11-20,Failure,Once community church.
1414,855,2025-06-22,Success,Easy community whatever each attack.
1415,246,2025-02-21,Pending,Special town south general.
1416,949,2024-11-07,Pending,Box those difficult front.
1417,84,2024-11-28,Pending,Someone raise almost talk ok spend.
1418,207,2024-09-24,Failure,Expect situation perhaps sense early themselves far.
1419,151,2024-12-24,Failure,Hour clear interview account Mr.
1420,668,2025-04-24,Pending,Nor science yourself discover call whole.
1421,528,2025-05-14,Pending,Sell bed they arm sister.
1422,165,2024-09-15,Pending,Hotel traditional particularly pass week brother drug market.
1423,917,2025-02-11,Pending,Away least onto everyone assume.
1424,975,2025-08-02,Pending,Himself other term.
1425,145,2025-05-20,Pending,Not top game worry.
1426,37,2025-02-24,Success,One Congress land reflect.
1427,333,2025-06-06,Pending,Loss discussion husband want.
1428,403,2024-11-21,Failure,List character table picture human.
1429,414,2025-06-07,Failure,Bill town red three international large.
1430,45,2024-11-26,Failure,Ago number citizen score mouth.
1431,402,2024-12-28,Pending,Firm case article coach black.
1432,206,2024-12-10,Failure,Reality team great fish even rest.
1433,62,2025-05-12,Success,Beyond policy federal program.
1434,420,2025-02-06,Pending,Military kid true.
1435,868,2024-12-24,Failure,Point end painting camera realize edge capital.
1436,468,2025-06-19,Success,Maybe door stand pick.
1437,820,2025-02-08,Success,Red music body Congress until account.
1438,19,2025-05-16,Failure,Low among manage him off which thing.
1439,365,2024-11-26,Success,Open worry involve believe.
1440,300,2025-03-26,Failure,Wall coach level myself face item arm mind.
1441,7,2024-12-02,Success,Size grow month court school commercial simple.
1442,761,2025-04-05,Pending,Report local identify commercial science entire.
1443,428,2024-08-31,Pending,By once collection figure describe sister themselves.
1444,117,2025-06-09,Pending,Bag one collection city contain go.
1445,580,2024-10-11,Pending,Mouth good somebody value.
1446,507,2024-10-14,Pending,Collection third feel common in open.
1447,546,2025-03-08,Failure,Thing position before watch society.
1448,706,2024-12-08,Pending,Two beautiful now company activity.
1449,325,2024-08-28,Pending,Painting pretty hour.
1450,55,2024-11-11,Pending,Always improve a truth through stock.
1451,778,2025-07-25,Pending,While guess create.
1452,992,2025-01-09,Success,Local expect always response.
1453,42,2025-03-24,Pending,Avoid say base detail have customer people care.
1454,297,2025-01-05,Pending,Student behavior wear develop system.
1455,973,2025-05-22,Failure,Information again more.
1456,231,2024-12-09,Success,Magazine also hundred hundred type security store.
1457,453,2024-12-15,Failure,Listen job candidate example.
1458,890,2025-05-23,Pending,Require government address for leg customer interest.
1459,394,2024-10-18,Failure,Step probably tax pull day test.
1460,522,2025-03-26,Failure,Skill boy poor society else.
1461,358,2025-04-21,Pending,Whole federal voice resource.
1462,987,2024-12-14,Success,Give tonight explain trip cultural condition.
1463,444,2025-02-18,Success,Probably home gun week thus sell instead.
1464,128,2025-05-21,Failure,So page conference window standard.
1465,691,2025-02-04,Pending,Speak list teach beyond nearly after.
1466,405,2025-05-06,Failure,Structure manager past country.
1467,392,2024-12-10,Failure,Recently American collection night knowledge.
1468,193,2024-10-16,Failure,Sign back many despite generation.
1469,604,2025-06-02,Pending,Someone may home eight now young.
1470,881,2025-06-26,Pending,Grow fall movie seat.
1471,743,2025-05-14,Success,Success carry nice among read common.
1472,78,2024-10-06,Pending,Its relationship as activity whatever other dinner.
1473,85,2024-10-13,Failure,Personal fine score environmental before risk.
1474,30,2025-04-10,Failure,Fly operation administration something ok.
1475,725,2024-12-09,Success,Local back public anyone major.
1476,49,2025-07-17,Pending,Say family lay what mission every.
1477,777,2025-01-14,Failure,Anything road bank sell successful white goal.
1478,145,2024-11-25,Success,Eight increase level quickly hold doctor.
1479,69,2025-04-22,Success,Under top site happy father really mind.
1480,58,2024-11-14,Failure,Second number voice chance little receive officer.
1481,697,2024-08-28,Failure,Action military free recently.
1482,574,2025-07-14,Pending,His face door in think almost tonight.
1483,479,2024-11-08,Success,Relationship know trip option early.
1484,820,2025-04-01,Failure,How popular program.
1485,445,2024-12-13,Success,Stage likely social.
1486,296,2024-10-14,Pending,Nature career same inside.
1487,678,2025-04-01,Failure,Treat politics simply pass side laugh positive.
1488,171,2024-08-22,Pending,Forget maybe forget our step hit.
1489,575,2024-11-26,Success,Of daughter quite college middle.
1490,147,2025-01-06,Pending,Than mean loss hundred score fire yes follow.
1491,484,2025-05-25,Pending,Such PM number.
1492,306,2025-03-03,Success,Stock reason around possible.
1493,673,2025-06-03,Pending,Institution record back ten radio kind imagine.
1494,653,2025-07-21,Success,Cost article attorney several official.
1495,846,2025-03-06,Failure,Listen want oil.
1496,609,2025-01-22,Success,Short meeting past pull.
1497,446,2025-02-19,Success,Staff us make no industry follow third.
1498,221,2025-04-15,Failure,Significant do bed scene two.
1499,555,2025-08-02,Success,Institution store particularly commercial onto citizen deal.
1500,945,2024-10-23,Failure,Movie west doctor this push down force reach.
