log_id,employee_id,log_date,status,remarks
1,381,2024-08-27,Failure,Popular onto may model her unit.
2,329,2024-12-13,Failure,That lot low here.
3,479,2024-12-02,Pending,Garden finally difference everything.
4,15,2025-02-12,Failure,Practice ground least tree.
5,516,2024-11-04,Success,Style suffer situation.
6,191,2024-09-25,Success,Together scientist hair allow phone weight medical.
7,168,2024-11-28,Pending,Network movement scientist their wife.
8,521,2025-04-29,Failure,Land mission each something.
9,621,2025-03-29,Pending,Ready practice each ready.
10,137,2025-02-17,Success,Concern without entire everyone sea safe true.
11,154,2025-01-11,Pending,Mission article dinner one.
12,388,2024-12-09,Failure,Local better think anything so authority long kind.
13,209,2025-01-31,Pending,Culture my Democrat maintain notice ok technology.
14,272,2024-09-23,Failure,Result kind politics open.
15,143,2024-11-12,Failure,Sense yeah edge imagine establish piece forget low.
16,611,2025-01-22,Success,Week federal test eat every.
17,889,2025-03-23,Success,Me personal born series consider according throw.
18,820,2024-12-04,Success,Like clear assume it fight understand kitchen.
19,69,2025-02-21,Failure,State cover board discussion film figure short.
20,247,2024-12-06,Pending,Bill feel participant number choice choose short.
21,261,2025-08-05,Failure,System particular church what.
22,788,2025-05-17,Success,President small sister especially usually line task.
23,79,2025-03-13,Success,He fill risk stop firm.
24,658,2025-03-02,Pending,Interesting hour individual several identify.
25,623,2024-11-20,Success,Government south window short affect region.
26,770,2025-01-13,Success,Product eight strategy age into.
27,605,2024-08-24,Success,For nice current Democrat me task.
28,525,2025-02-27,Pending,Avoid civil reveal walk.
29,772,2025-05-27,Failure,Like wife animal process reach training main exactly.
30,938,2025-01-17,Success,Only arrive argue garden Mrs just exist line.
31,621,2025-01-09,Pending,Foot simple including charge.
32,330,2025-06-10,Success,Operation off no just.
33,189,2025-03-18,Pending,Of several end most fact against.
34,95,2025-05-22,Success,That recognize school whatever.
35,617,2024-09-29,Pending,Toward knowledge this contain life leave.
36,8,2025-02-09,Success,Current will else page usually cell.
37,67,2024-11-13,Failure,Interview south something story art writer.
38,496,2025-03-30,Success,Administration join allow mean sometimes so.
39,191,2024-08-27,Pending,Executive free attack away begin next both.
40,366,2025-01-19,Success,Sometimes suffer because two.
41,768,2025-06-13,Failure,Practice course authority range stand letter threat yes.
42,521,2024-11-16,Success,Practice authority possible fund.
43,990,2025-02-07,Pending,Sit science way threat husband family perhaps.
44,117,2025-01-08,Pending,Affect different interview else development purpose.
45,267,2025-02-19,Failure,Mother president customer start understand throw.
46,611,2025-03-24,Pending,Check significant deal consider ago own suddenly.
47,485,2024-09-29,Success,Music west force firm.
48,509,2025-04-24,Success,Probably cut clear yard do.
49,298,2024-12-16,Success,Sign agree there want but.
50,909,2024-12-25,Pending,Agent test take decade any just.
51,164,2024-10-12,Success,Day herself sport behavior compare.
52,376,2025-06-28,Success,Right business series build major painting see first.
53,653,2025-04-19,Success,Decision before medical long meet.
54,268,2024-09-19,Failure,Administration herself information which beyond growth finally.
55,549,2024-09-24,Pending,Its summer feel yourself.
56,74,2025-03-23,Pending,Practice special then administration.
57,508,2024-10-22,Pending,Role today animal suggest concern.
58,73,2024-11-06,Failure,Campaign choose reason.
59,308,2025-07-19,Pending,Article sort term.
60,199,2025-08-18,Failure,He increase church common view.
61,130,2025-02-24,Failure,Score special consider these.
62,758,2025-04-05,Pending,Skill air daughter idea.
63,824,2024-11-23,Success,Training enter fly situation former threat.
64,572,2024-09-19,Success,Same certain imagine.
65,791,2024-10-11,Pending,Help out modern citizen address today begin.
66,615,2025-01-21,Pending,Both little work task.
67,808,2025-04-14,Failure,Key tax speak a live tonight either.
68,832,2025-07-09,Pending,Prevent half party respond local see.
69,487,2025-02-17,Failure,Cultural despite candidate walk difficult bank believe.
70,853,2025-03-09,Pending,Executive past economic economy role feeling.
71,151,2025-05-25,Success,Property mind officer third service capital instead.
72,669,2025-07-10,Success,Often various alone town.
73,206,2025-03-26,Pending,Place some woman add play structure.
74,986,2025-06-09,Failure,Class follow occur low gas.
75,179,2024-11-16,Success,Thank wife if yeah law enjoy key seat.
76,197,2024-09-09,Failure,Under front throughout effort southern maintain nature.
77,735,2025-06-12,Pending,Property garden mind as.
78,89,2025-02-25,Pending,Interview agent myself behind window store.
79,799,2024-11-23,Success,Nearly fast their film.
80,434,2025-01-24,Pending,Network vote whom will consumer star.
81,788,2024-12-16,Success,Crime style develop admit safe government over.
82,748,2025-06-01,Failure,None most another mouth.
83,183,2024-12-27,Success,Discover water most hear beyond close plant.
84,209,2025-07-08,Success,Difficult us respond must western interest dark any.
85,493,2024-10-15,Failure,Fast too will throw life carry.
86,130,2024-09-01,Success,A edge new find type.
87,665,2024-12-20,Success,Order at sense cell lose civil will with.
88,13,2025-05-12,Pending,Hospital city industry option eat.
89,634,2025-03-25,Failure,Audience white everybody throughout but science.
90,871,2025-04-07,Success,Day central every force.
91,732,2025-01-22,Failure,Minute modern sign out.
92,106,2025-07-22,Failure,Produce federal by sea lawyer.
93,375,2024-08-20,Success,They senior result themselves.
94,582,2024-11-30,Pending,High through both.
95,707,2025-05-13,Failure,International collection report tend maintain fact mission.
96,698,2024-11-07,Success,Young owner out guy.
97,99,2025-06-07,Failure,Student white instead point tend exactly right.
98,594,2025-03-24,Pending,Toward policy forget project economy.
99,587,2025-06-22,Pending,Bar big south drug manager opportunity.
100,886,2025-02-23,Pending,Billion sit remain night study.
101,852,2025-03-17,Success,Parent that property among blue study.
102,192,2025-02-28,Success,Offer brother shake guess.
103,325,2024-12-17,Pending,Instead hour season girl small system of mission.
104,979,2025-04-28,Success,Spend physical sing protect agent note.
105,726,2024-11-17,Pending,Piece forget factor.
106,827,2024-12-20,Success,Soon rock support effect stand general.
107,956,2025-02-13,Pending,Everybody situation foot recognize play.
108,467,2025-05-20,Failure,Decide side natural focus.
109,894,2025-02-21,Pending,Send sit common matter become goal.
110,367,2025-03-05,Pending,Science structure dinner stock big reveal police.
111,318,2025-03-21,Success,Perform police series dark task magazine.
112,144,2025-07-17,Success,South time senior where follow born.
113,384,2025-06-01,Success,Financial media politics fast nice concern peace away.
114,216,2025-05-29,Success,Bed our theory identify.
115,361,2024-09-18,Success,Certainly future government card history.
116,324,2025-08-10,Success,Party wife food different step.
117,15,2024-09-27,Failure,Nature property event manager street.
118,217,2025-01-30,Pending,Early difficult possible democratic actually.
119,492,2025-05-16,Pending,Who tax low keep news.
120,951,2024-09-17,Pending,Court control million hundred offer total hit.
121,547,2025-01-10,Failure,Religious word sound enjoy have.
122,183,2024-10-06,Pending,Floor ground when care team.
123,270,2025-06-07,Failure,Somebody often benefit true world.
124,945,2024-08-23,Failure,Movement bit step direction give reduce with.
125,467,2024-10-19,Failure,Let off apply peace market.
126,870,2025-03-07,Pending,Ask yet against large practice time.
127,612,2025-06-04,Failure,Test challenge radio assume rest now water.
128,519,2024-10-04,Pending,Require make region.
129,542,2024-10-21,Pending,Worry Democrat laugh Mrs.
130,467,2024-11-02,Success,Form now then watch certain.
131,305,2025-02-03,Success,Woman only television wife apply senior onto.
132,985,2025-07-21,Failure,Pass morning room run.
133,144,2024-10-01,Failure,Woman similar writer structure ahead.
134,111,2024-09-02,Pending,Rock forward behind idea red rate source.
135,232,2025-07-27,Failure,Recent catch gas benefit great religious.
136,691,2025-01-29,Failure,Matter continue husband dinner worry.
137,584,2025-02-26,Pending,Fund sell model after.
138,722,2024-10-23,Failure,Article news radio believe ability world actually force.
139,732,2025-04-18,Failure,Agree toward nor teacher western.
140,592,2025-06-25,Pending,Pm marriage movement wish best.
141,500,2025-03-09,Pending,Outside off through relationship.
142,595,2025-02-23,Success,Medical sport knowledge performance.
143,554,2024-10-11,Pending,Thousand soldier build various various blue raise.
144,273,2025-06-04,Success,Million too marriage page young turn visit up.
145,703,2025-07-23,Failure,Story six want protect assume east center.
146,173,2025-03-18,Pending,Could identify group true TV specific travel.
147,973,2025-01-27,Pending,Better mind professional fly month offer mother hour.
148,7,2025-01-20,Pending,Poor executive career shake fall phone identify.
149,155,2024-08-21,Failure,Bank agency bit night participant fill.
150,522,2024-12-11,Success,Side recognize month among water.
151,546,2024-10-02,Failure,Throughout security number community finish.
152,548,2025-02-03,Failure,Move another field.
153,921,2024-12-10,Pending,Goal Mrs statement range its.
154,518,2025-05-24,Success,Model condition he recognize treat better wear.
155,920,2025-08-11,Failure,Republican authority data deal policy.
156,914,2025-07-25,Pending,And high too.
157,215,2025-05-07,Failure,Under above drive sport.
158,134,2024-12-01,Failure,Worker would step head study and.
159,285,2025-03-08,Pending,Out perform election two.
160,126,2024-12-21,Pending,Report top finally wait president trial important.
161,921,2025-04-13,Success,Indeed including everything.
162,439,2025-07-29,Failure,Stage major outside phone house.
163,849,2025-01-09,Pending,Can ready audience boy city social at.
164,686,2025-03-24,Pending,Force want either race us huge movie.
165,152,2025-04-27,Success,Talk end set house those.
166,331,2024-10-21,Success,Wear never marriage camera yet.
167,538,2024-10-11,Pending,Long born also hold base really attack.
168,383,2024-12-08,Success,Past just central others American value.
169,115,2025-03-09,Pending,Shoulder right analysis add check.
170,894,2025-05-11,Failure,Two glass customer popular hospital.
171,482,2024-11-05,Success,Water measure different physical.
172,284,2025-06-25,Failure,Price keep the attorney early more.
173,899,2025-04-13,Failure,Claim natural fish born assume million admit.
174,75,2025-05-22,Failure,Right focus although top.
175,166,2025-01-09,Pending,Accept about around hold note.
176,189,2025-03-07,Failure,Several along nation after station.
177,78,2025-04-09,Failure,Visit population executive pattern last security raise.
178,947,2024-11-23,Failure,Economic woman PM look together lawyer these difference.
179,602,2025-02-17,Pending,Pm company whose yourself think.
180,688,2025-02-13,Failure,Science it feel amount improve they.
181,21,2024-11-07,Failure,Would by phone decade image.
182,566,2025-08-16,Success,Leave laugh weight less full program.
183,184,2024-12-24,Pending,Rich day describe course.
184,871,2025-08-13,Failure,Way role six guy leg.
185,222,2025-06-04,Success,Hear fill hotel like myself laugh.
186,827,2025-05-24,Pending,Include current front three process view it wall.
187,328,2025-07-15,Pending,Really history project.
188,179,2025-08-13,Pending,Worker quite shoulder political offer.
189,788,2024-10-09,Pending,Character first early school several.
190,112,2024-10-20,Pending,First usually partner same then put skin.
191,736,2025-03-09,Pending,Again turn thank former.
192,726,2025-05-22,Failure,Finish top data character.
193,59,2025-07-06,Failure,Film at perhaps firm toward.
194,327,2025-02-18,Failure,Little region face big no too charge.
195,905,2024-08-21,Failure,Budget travel important no pick record.
196,621,2024-12-19,Success,Ready tough wish professional chair.
197,897,2025-01-26,Failure,Best always they list local short.
198,669,2024-10-26,Pending,Read stand us once consider thus wife water.
199,191,2024-10-15,Failure,Gas fund be have concern perhaps quality.
200,200,2025-02-16,Failure,Book various whether culture.
201,312,2024-09-13,Pending,Factor society skill great worker manager.
202,708,2024-08-20,Failure,Through individual college surface court exactly minute trouble.
203,35,2024-12-17,Failure,Five cold power red enjoy you front.
204,379,2025-05-17,Failure,Seek service leader bag necessary.
205,387,2024-10-29,Success,The unit action off.
206,758,2024-11-03,Failure,Herself toward here along public.
207,237,2025-05-14,Pending,Friend sort table six imagine garden.
208,616,2024-09-23,Pending,Rest need major entire tree try.
209,519,2025-03-14,Failure,South tree technology time.
210,283,2025-02-12,Failure,Specific south blood.
211,1,2024-12-24,Failure,Computer assume occur down.
212,731,2024-09-23,Pending,Tell act add southern.
213,464,2024-09-10,Pending,Audience old whole wide piece former professor partner.
214,230,2025-04-17,Success,Region current second ball.
215,967,2025-02-16,Success,Responsibility before item rate.
216,172,2025-04-05,Success,Anyone bag fly more live.
217,87,2024-10-17,Pending,Remain manager relationship light rule.
218,553,2024-09-12,Success,Ten article continue according compare culture century my.
219,123,2025-01-01,Failure,Record reflect away cost focus.
220,843,2025-04-22,Failure,Class play or own media.
221,298,2025-03-23,Pending,Design economy general drive according.
222,885,2025-07-27,Success,Example claim article management total.
223,929,2024-11-13,Failure,People stage bag share.
224,690,2024-12-29,Pending,Activity season because open trouble guess race.
225,575,2025-04-19,Success,Notice road five group.
226,484,2024-08-23,Failure,Have feel major national seat direction color.
227,165,2025-08-13,Success,Important they food someone war idea.
228,699,2024-10-31,Pending,Laugh center seek information agency cause first.
229,383,2024-12-02,Success,Change hand its stage town character watch describe.
230,209,2024-12-06,Pending,Hospital change front.
231,739,2025-07-02,Success,Market citizen stop.
232,432,2025-08-06,Failure,Everyone couple parent material itself surface maintain.
233,389,2025-07-21,Pending,Government black well relationship.
234,560,2025-01-30,Pending,Eye dog wall sound indicate actually final city.
235,224,2025-04-01,Pending,Financial peace particularly out morning game health read.
236,3,2025-05-28,Success,Hard wife as language.
237,372,2024-12-14,Success,Early war read travel total plant.
238,687,2025-01-07,Failure,Skill never officer former create camera focus.
239,446,2025-04-17,Pending,Occur treat remain participant spend eat none three.
240,611,2025-06-11,Pending,Memory believe seek perhaps ball make.
241,116,2025-01-21,Success,Too water road at hope cover show Republican.
242,270,2025-08-15,Success,Summer arrive east plan force station.
243,447,2024-11-24,Failure,No situation what machine fire third customer.
244,368,2025-03-23,Failure,Whatever our build safe save.
245,253,2025-03-16,Success,Model mean eat heavy red.
246,317,2025-04-24,Pending,Fear daughter fast.
247,415,2025-05-01,Failure,Prepare several bad.
248,95,2024-11-04,Success,Simply year land high church know finish.
249,785,2024-09-17,Success,Lay cup paper expect only.
250,892,2025-04-05,Pending,What buy test need hard firm.
251,24,2024-10-16,Success,Nearly pick position how force structure.
252,628,2024-09-26,Success,Poor food series.
253,663,2025-05-28,Failure,Third argue response.
254,850,2024-11-10,Success,Market until cause bill.
255,50,2024-12-04,Success,Vote dog senior win.
256,502,2024-10-26,Failure,Ball gas attorney hundred artist indicate.
257,718,2024-11-28,Pending,Reason nature become debate city several.
258,498,2025-03-24,Pending,Dinner argue raise agency poor.
259,335,2024-09-26,Failure,Long among serve wear west.
260,79,2024-10-06,Failure,May follow series prove.
261,582,2025-06-23,Pending,Member face age.
262,27,2025-03-08,Pending,Nearly always operation decade old according.
263,271,2025-04-03,Pending,Ok happy together clearly.
264,562,2025-04-25,Pending,Charge account physical performance enter.
265,804,2025-06-11,Pending,Memory civil cut parent free force.
266,247,2025-01-13,Failure,Hotel practice later knowledge whose.
267,776,2024-12-24,Success,Show daughter both hold blood value day.
268,591,2025-03-29,Pending,Save fear ready Democrat order field less.
269,387,2025-06-13,Pending,Discover three such describe agency actually stop team.
270,702,2025-07-15,Success,Matter result result leader hospital.
271,559,2025-04-04,Success,Tv lose others some.
272,973,2025-04-09,Success,Back blue a all anyone.
273,361,2024-12-03,Success,Water us field.
274,866,2025-06-27,Success,Rock which best happy position wife.
275,984,2025-05-31,Success,Away individual against side together few.
276,488,2025-07-22,Failure,Lead usually work trip build.
277,352,2025-04-14,Success,They usually company.
278,701,2025-05-04,Success,Beat doctor thank often.
279,928,2025-08-06,Failure,Event against none as reality democratic huge.
280,256,2025-02-17,Success,Air market store include win officer.
281,222,2024-11-07,Pending,Prevent where then.
282,884,2024-10-22,Pending,Rest dark environment provide white.
283,753,2024-08-19,Success,Dog language ability practice them.
284,781,2025-06-18,Failure,Next reflect social resource score expert.
285,1,2024-11-16,Pending,Our lead line clearly.
286,546,2024-11-10,Failure,Risk must fly police imagine oil.
287,446,2024-09-22,Pending,Level girl factor sport seem manager.
288,79,2025-08-14,Success,Imagine which beat education case under population.
289,236,2025-06-25,Failure,Send technology clearly amount media teacher person.
290,334,2025-04-13,Failure,Game plan seat surface off with society station.
291,889,2024-10-13,Failure,Bank industry born may among billion.
292,349,2024-10-12,Pending,Effort nearly walk.
293,98,2024-10-21,Pending,Range skin major for student.
294,82,2025-02-18,Pending,Nature house prevent hotel officer seek.
295,502,2025-07-23,Success,Difficult popular choose really.
296,967,2024-08-18,Pending,Respond throw wide son manager.
297,477,2024-12-21,Success,Reason fill sense field.
298,927,2024-09-17,Failure,My benefit sport age all.
299,704,2025-07-31,Failure,Debate still quite attack.
300,765,2024-09-07,Success,Week instead group idea recently feel hold.
301,921,2024-10-10,Pending,Field people try play order.
302,550,2025-03-04,Success,With matter goal eight list something send.
303,14,2025-06-27,Failure,Institution onto thing we.
304,392,2025-02-04,Failure,Yes here while service beautiful edge begin.
305,347,2025-01-30,Success,Right resource two lawyer see.
306,310,2025-05-03,Pending,Page light follow need region.
307,386,2025-02-17,Pending,Describe improve act campaign television sit very.
308,209,2024-12-23,Success,Attorney Congress ever north soon movie.
309,357,2024-12-13,Success,Education brother might.
310,974,2025-02-28,Pending,Total fall clear face.
311,601,2025-06-09,Failure,Interview rather why baby lot eat.
312,568,2024-10-02,Success,Simply southern town significant analysis consumer.
313,94,2024-11-19,Pending,Tend on management research space way.
314,93,2025-03-23,Pending,Big cause science water.
315,340,2025-01-17,Failure,Age many some involve remain today happy.
316,597,2025-01-11,Failure,Blood list everything newspaper institution assume enjoy.
317,445,2025-06-14,Failure,Listen medical during until case agency.
318,757,2025-01-14,Failure,Now professor land you.
319,22,2025-05-19,Failure,Newspaper long wife prevent old break.
320,291,2025-02-18,Success,Discussion challenge card.
321,485,2025-01-02,Pending,Action art small both program one.
322,784,2024-12-17,Success,Field specific floor.
323,306,2025-07-09,Success,Team song country listen long.
324,634,2025-03-08,Success,Common need phone teach.
325,128,2024-12-19,Success,Certainly camera member technology.
326,625,2025-03-12,Success,Local wrong authority clearly.
327,939,2024-09-17,Failure,Send style gun different energy arrive it that.
328,273,2025-07-27,Failure,Agree public us hospital paper term.
329,848,2025-04-10,Pending,Look we meeting image.
330,442,2025-07-11,Success,Drop miss market avoid.
331,503,2024-11-09,Pending,All at be through certainly political hard hotel.
332,130,2024-10-21,Failure,Practice would game student painting try talk.
333,132,2025-04-21,Failure,Memory history that read receive type painting.
334,597,2025-07-07,Failure,Case front reality window mouth pattern as.
335,935,2024-12-03,Success,Environmental even eye message fine town trade not.
336,482,2025-05-21,Success,Win court friend put everything our.
337,862,2024-10-12,Failure,Shoulder three cause show far.
338,390,2025-07-10,Pending,Republican need daughter leg minute bring.
339,593,2025-02-03,Pending,Police day so store consumer.
340,999,2025-03-23,Failure,Heart hot response usually learn game effort.
341,985,2025-02-05,Pending,Education whom spend worker.
342,325,2025-02-24,Failure,At speech effort.
343,69,2025-05-14,Pending,Lawyer yard on everyone note current anything.
344,660,2025-06-20,Failure,Physical majority blue join finish cause.
345,448,2024-11-23,Pending,Guess soon approach suggest.
346,528,2025-05-11,Success,Blue movement camera benefit sea.
347,819,2024-10-03,Failure,Daughter through note act front person.
348,617,2025-03-22,Failure,Exist drive determine page seem.
349,165,2025-08-02,Pending,Government door age once several commercial whom.
350,488,2025-02-03,Failure,Data pattern west before science without.
351,713,2025-04-28,Failure,Special buy east image drug.
352,709,2024-12-31,Failure,Close community detail blue draw final often outside.
353,426,2024-10-26,Success,Land discussion suggest impact know character.
354,697,2024-08-27,Success,Sure seek age share day pull.
355,834,2025-07-20,Pending,Smile model focus material past study.
356,265,2025-01-07,Success,Day certain back student raise collection identify design.
357,875,2025-07-16,Pending,If eat fact discuss over like.
358,612,2025-02-15,Success,Rather none population.
359,342,2025-06-13,Pending,Laugh son home generation.
360,832,2025-05-05,Success,After job knowledge interest join give.
361,726,2024-12-30,Success,Hand young long collection table.
362,278,2025-05-27,Pending,Out special suffer without hair set bed.
363,674,2025-01-29,Failure,Begin receive anyone bad.
364,439,2024-11-09,Failure,Laugh fall teach everything trouble.
365,157,2025-04-14,Success,Important coach at the per.
366,422,2025-03-23,Pending,Pressure six west walk compare nature walk.
367,251,2025-07-24,Failure,Door space crime Republican.
368,878,2025-08-10,Pending,Significant especially situation move.
369,609,2025-08-17,Failure,Network hard condition move cost skin for.
370,530,2024-10-31,Pending,Short message again mean.
371,327,2025-01-13,Success,Hour cold light suffer.
372,961,2025-01-10,Pending,Technology strong off evidence early.
373,895,2024-10-26,Failure,Report require class paper.
374,97,2025-08-15,Success,Attack help a.
375,513,2025-06-04,Pending,More majority senior nearly risk threat level.
376,216,2024-08-22,Failure,Government painting responsibility see seem model imagine.
377,132,2024-11-02,Success,Teach call already available yes success break.
378,260,2025-02-05,Pending,Him federal agency maintain seek democratic.
379,125,2025-01-05,Failure,Last opportunity serve cause.
380,82,2025-03-10,Pending,How central too tough education.
381,283,2024-11-01,Pending,Letter let think leg indeed anything.
382,683,2024-08-20,Success,Today two far apply.
383,59,2025-04-02,Success,Travel thought the back family start necessary.
384,544,2024-12-16,Failure,Value than look.
385,161,2024-12-23,Success,Former financial medical action big season.
386,284,2024-09-23,Failure,Especially agency despite minute agency idea sometimes.
387,106,2025-08-06,Pending,Get force happy song one third serve.
388,105,2025-01-08,Pending,Shake already single rock not attack.
389,439,2025-08-08,Failure,Usually help produce key.
390,228,2024-11-24,Pending,Century several cultural pattern every.
391,700,2025-03-01,Success,Among field well create notice.
392,582,2025-08-10,Pending,Son third interview nothing wrong decision.
393,318,2024-08-23,Success,Clear also road skin.
394,464,2025-04-10,Failure,Life wonder understand management bag.
395,802,2024-12-02,Failure,Speech garden road head light what officer.
396,599,2024-08-31,Pending,Threat sport former professor money property structure.
397,882,2025-04-26,Pending,Mind everything order to difficult against low foreign.
398,874,2024-12-02,Success,Feel win yard anything option soon election.
399,472,2025-04-24,Success,Never such despite what.
400,56,2025-02-19,Pending,Toward unit recently media include hundred note.
401,625,2025-01-19,Pending,Ball class loss up at.
402,13,2024-09-04,Failure,Unit arm image it increase within.
403,440,2025-05-15,Failure,Visit brother dog these man when.
404,18,2025-05-18,Failure,Degree involve dog during source from our order.
405,694,2024-11-24,Pending,Beyond bank scene change.
406,973,2024-12-02,Pending,Manage begin wide space possible yeah.
407,113,2025-04-17,Pending,Likely allow fact.
408,229,2024-09-09,Failure,Quickly truth record program beautiful close.
409,171,2025-03-28,Pending,Form although old write pass.
410,295,2025-07-03,Success,Smile today station make environment.
411,189,2024-08-29,Pending,Past moment story expect assume.
